"name","description","prep_time","status"
"Green curry","Tasty tasty","","true"
"Chicken satay","Yow","","false"
"Pork Orloff Roast","Ingredients : . Season the pork well with salt and pepper. Place the pork in a baking dish. Place the dish in the oven, and cook for 50 minutes. Cut slits into the pork, stopping just before you cut through so that the slices stay connected at...","10 min","true"
"Beef kidney","Ingredients : beef, flour, butter, mustard, salt, parsley. Stir-fry the mushrooms for 7 mins. on high heat in 10 g/0.35 oz. butter, salt, pepper. Put the rest of the butter in a skillet (50 g/1.76 oz.), when it gets very hot, brown the kidney...","15 min","false"
"Lamb shoulder or leg with honey and thyme","Ingredients : thyme, butter, salt, honey, garlic. Preheat the oven to 180°C/360°F (thermostat 6). Coat the leg generously with honey on all its sides (a 5 mm-thick layer). Do not use a liquid honey, otherwise it will flow! Sprinkle the whole leg with...","10 min","false"
